name,ring,quadrant,isNew,description
GraphQL,Avalie,Linguagens & Frameworks,TRUE,"GraphQL é uma linguagem de consulta criada pelo Facebook em 2012 e lançada publicamente em 2015.[2] É considerada uma alternativa para arquiteturas REST, além de oferecer um serviço runtime para rodar comandos e consumir uma API."
FileHelpers,Avalie,Linguagens & Frameworks,TRUE,Biblioteca que facilita manipulação de arquivos
AutoMapper,Avalie,Linguagens & Frameworks,TRUE,Biblioteca para transformação de dados
SignalR,Avalie,Linguagens & Frameworks,TRUE,SignalR é uma biblioteca de software para o Microsoft ASP.NET que permite que o código do servidor envie notificações assíncronas para aplicativos da Web do lado do cliente
Helm e Helmfile,Avalie,Linguagens & Frameworks,TRUE,é uma ferramenta para gerenciamento de pacotes para o Kubernetes
Regra de negócio Delphi,Evite,Linguagens & Frameworks,TRUE,"O Delphi é legado. Ele é restrito ao Win32, estamos indo na direção da multi-plataforma (Linux/Windows). Utilize o .NET."
Regra de negócio VBA,Evite,Linguagens & Frameworks,TRUE,"O VBA é legado. Ele é restrito ao Win32, estamos indo na direção da multi-plataforma (Linux/Windows). Utilize o .NET."
Silverlight,Evite,Linguagens & Frameworks,TRUE,"O Silverlight é uma plataforma proprietária desenvolvida pela Microsoft para prover um conteúdo multimídia a partir do navegador web, desenvolvido para concorrer diretamente com as tecnologias Flash e Flex da Adobe. Ele é capaz de reproduzir conteúdos de altíssima qualidade (como 1080p) através dos codecs de vídeo VC-2 e H.264, fornecendo um excelente nível de transmissão via streaming."
Stored Procedure,Evite,Linguagens & Frameworks,TRUE,"Stored Procedure é uma consulta SQL que pode ser salva para ser reutilizada, podendo ser fixa ou receber parâmetros, retornar ou não resultados. O banco armazena em cache as consultas, fazendo as Stored Procedures serem mais performáticas."
SQL Específico para banco de dados,Evite,Linguagens & Frameworks,TRUE,"Nossas soluções precisam rodar em SQLServer, Oracle e PostgreSQL, portanto qualquer comando escrito deve ser compatível com qualquer banco."
Web Services com SOAP,Evite,Linguagens & Frameworks,TRUE,"O protocolo SOAP, abreviação para Simple Object Access Protocol, é uma especificação para a troca de informação entre sistemas, ou seja, uma especificação de formato de dados para envio de estruturas de dados entre serviços, com um padrão para permitir a interoperabilidade entre eles. Seu design parte do princípio da utilização de XMLs para a transferência de objetos entre aplicações, e a utilização, como transporte, do protocolo de rede HTTP."
Git,Adote,Plataformas,TRUE,"Git é um sistema open-source de controle de versão. Com ele podemos criar todo histórico de alterações no código do nosso projeto e facilmente voltar para qualquer ponto para saber como o código estava naquela data. Além disso, o Git nos ajuda muito a controlar o fluxo de novas funcionalidades entre vários desenvolvedores no mesmo projeto com ferramentas para análise e resolução de conflitos quando o mesmo arquivo é editado por mais de uma pessoa em funcionalidades diferentes."
Gitlab,Adote,Plataformas,TRUE,"O GitLab é um gerenciador de repositório de software baseado em git, com suporte a Wiki, gerenciamento de tarefas e CI/CD. GitLab permite que os desenvolvedores armazenem o código em seus próprios servidores, ao invés de servidores de terceiros."
Jenkins,Adote,Plataformas,TRUE,"Jenkins C.I. é uma aplicação web de Integração Contínua que pode ser instalada em qualquer máquina e serve, principalmente, para executar os testes e criar os artefatos de um projeto de software."
WES,Adote,Plataformas,TRUE,"O Web Enterprise Suite (WES) é uma solução completa para o desenvolvimento e execução de aplicações corporativas no ambiente Web. Possui uma interface moderna e intuitiva, que se adapta a dispositivos móveis e é orientada a papéis. O usuário só vê o que é relevante para o papel que ele está desempenhando, garantindo assim uma boa usabilidade. O WES entrega uma interface padrão com uma série de recursos fundamentais como navegação, menus, atalhos, grids, formulários, filtros, autenticação, autorização, monitoramento, log e auditoria. Esta interface pode ser amplamente customizada."
Docker,Experimente,Plataformas,TRUE,"Docker é uma plataforma para criação e adminsitração de ambientes isolados, chamados containers de forma ampla e de alto desempenho, muito mais rápida que a virtualização convencional."
Kubernetes,Experimente,Plataformas,TRUE,Kubernetes é uma plataforma open source que automatiza as operações dos containers Linux. Essa plataforma elimina grande parte dos processos manuais necessários para implantar e escalar as aplicações em containers.
Nuvem Pública,Experimente,Plataformas,TRUE,"A nuvem pública é definida como uma série de serviços de computação oferecidos por terceiros à Internet pública, os quais são disponibilizados a qualquer pessoa que queira utilizá-los ou comprá-los. Eles podem ser gratuitos ou vendidos sob demanda, permitindo que os clientes paguem apenas pelo seu consumo de ciclos de CPU, armazenamento ou largura de banda."
Identity Server,Avalie,Plataformas,TRUE,"Servidor de gestão centralizada de identidades e permissões, é necessário em ambientes de microsserviços onde cada serviço precisa delegar a autenticação para um serviço dedicado a isso."
Flutter,Avalie,Plataformas,TRUE,"Flutter é um framework para desenvolvimento de aplicativos para dispositivos móveis, Desktop ou Web utilizando a linguagem Dart como base de criação dos aplicativos."
Mobile nativo,Avalie,Plataformas,TRUE,Soluções nativas para aplicativos mobile.
SaaS,Avalie,Plataformas,TRUE,"SaaS (Software as a Service), em português ""software como um serviço"". São aplicações online que podem ser usadas no computador, tablet ou celular, de maneira simples e remota. É um programa que não é instalado e que é usado como um serviço através da conexão com a Internet. Como um serviço, significa que o cliente não compra a licença de um produto, mas sim o direito de usufruir do serviço oferecido."
Drools,Avalie,Plataformas,TRUE,Motor de regras de código fonte aberto
jBPM,Avalie,Plataformas,TRUE,BPM de código fonte aberto
WES 2006,Evite,Plataformas,TRUE,Solução descontinuada da Benner para sistemas de gestão na Web. Evite! Utilize o WES.
DSS,Evite,Plataformas,TRUE,Solução descontinuada de BI.
Runner,Evite,Plataformas,TRUE,"O Runner é a ferramenta Benner responsável pela execução dos sistemas no desktop. Se utiliza dos metadados alimentados pelo Builder para gerar uma interface funcional do sistema, em tempo de execução. A interface é dividida em módulos. Uma Ribbon dá acesso as principais funções de cada módulo. Os dados são exibidos em pastas e subpastas, conforme a relação entre eles."
